{"$schema":"../../packages/contracts/schemas/release-manifest.schema.json","aggregate_reconciled":true,"created_at":"2026-08-04T00:36:28.591545+00:00","data_version":"historical-2022-mmv-context-v2-705d3d71523003b8","datasets":[{"byte_size":7031308,"content_hash":"85065bec750991d1fbff47eb02372b9b7e23fa4110e2088287e1cdda561f0d69","filters":{"data_version":"historical-2022-mmv-context-v2-705d3d71523003b8","election_slugs":"presidencia-2022-round-1,presidencia-2022-round-2","legal_status":"context_only","source_type":"contextual_baseline"},"format":"parquet","id":"historical-2022-mmv-parquet","record_count":1125896,"schema_url":"https://eleccionesabiertas.co/schemas/historical-mmv-row.schema.json","title":{"en":"2022 mesa-level results","es":"Mesa a mesa 2022"},"url":"https://eleccionesabiertas.co/releases/historical-2022-mmv-context-v2-705d3d71523003b8/datasets/historical-2022-mmv-parquet/85065bec750991d1fbff47eb02372b9b7e23fa4110e2088287e1cdda561f0d69.parquet"},{"byte_size":4783526,"content_hash":"4d599c00310b2174476066335cc684a8c15b0d8920a335d1ce969ff007b4098b","filters":{"data_version":"historical-2022-mmv-context-v2-705d3d71523003b8","election_slugs":"presidencia-2022-round-1,presidencia-2022-round-2","legal_status":"context_only","source_type":"contextual_baseline"},"format":"parquet","id":"historical-2022-rollups-parquet","record_count":1349277,"schema_url":"https://eleccionesabiertas.co/schemas/historical-rollup-row.schema.json","title":{"en":"2022 derived rollups","es":"Agregados derivados 2022"},"url":"https://eleccionesabiertas.co/releases/historical-2022-mmv-context-v2-705d3d71523003b8/datasets/historical-2022-rollups-parquet/4d599c00310b2174476066335cc684a8c15b0d8920a335d1ce969ff007b4098b.parquet"},{"byte_size":1040721,"content_hash":"7b8eab28da2027f23f7247f5a7dc90c3c4df6d08c9b06f07f0c59a55853744e4","filters":{"data_version":"historical-2022-mmv-context-v2-705d3d71523003b8","election_slugs":"presidencia-2022-round-1,presidencia-2022-round-2","legal_status":"context_only","source_type":"contextual_baseline"},"format":"parquet","id":"historical-2022-geography-parquet","record_count":241652,"schema_url":"https://eleccionesabiertas.co/schemas/historical-geography.schema.json","title":{"en":"2022 geographic hierarchy","es":"Jerarquía geográfica 2022"},"url":"https://eleccionesabiertas.co/releases/historical-2022-mmv-context-v2-705d3d71523003b8/datasets/historical-2022-geography-parquet/7b8eab28da2027f23f7247f5a7dc90c3c4df6d08c9b06f07f0c59a55853744e4.parquet"}],"election_slug":"presidencia-2022-historical-context","git_commit":"frozen-control-2026-08-04","methodology_version":"historical-context-2022/2.0.0","notes":{"en":"Historical MMV context: rounds 1/2 contain 103364/103364 observed mesas; expected national coverage is unknown. It is not verified pre-count, scrutiny, or final declaration data.","es":"Contexto histórico MMV: rondas 1/2 con 103364/103364 mesas observadas; la cobertura nacional esperada es desconocida. No es preconteo, escrutinio ni declaración final verificada."},"parser_versions":{"historical_mmv_2022":"historical-mmv-2022/2.0.0"},"release_id":"historical-2022-mmv-context-v2-705d3d71523003b8","schema_version":"1.0.0","sources":[{"byte_size":5064481,"content_hash":"52443174bbe5c09d73a1b0538a1a9ae5f78afb934c7b8f98f93ea52b41872769","coverage":{"ambiguous":0,"excluded":0,"expected":1,"missing":0,"parsed":1,"retrieved":1},"id":"registraduria-observatorio-2022-round-1","legal_status":"context_only","media_type":"application/zip","parser_version":"historical-mmv-2022/2.0.0","retrieved_at":"2026-08-04T00:36:28.211644+00:00","source_type":"contextual_baseline","source_url":"https://observatorio.registraduria.gov.co/anexos/MMV_NACIONAL_PRESIDENTE_2022_1v.zip","transform_version":"historical-rollup/2.0.0"},{"byte_size":2933014,"content_hash":"175ad5884ee6aceb9fb36782990c2bbabb0a4f2c84e41dbbcc74c824816c1b61","coverage":{"ambiguous":0,"excluded":0,"expected":1,"missing":0,"parsed":1,"retrieved":1},"id":"registraduria-observatorio-2022-round-2","legal_status":"context_only","media_type":"application/zip","parser_version":"historical-mmv-2022/2.0.0","retrieved_at":"2026-08-04T00:36:28.591545+00:00","source_type":"contextual_baseline","source_url":"https://observatorio.registraduria.gov.co/anexos/MMV_NACIONAL_PRESIDENTE_2022_2v.zip","transform_version":"historical-rollup/2.0.0"}],"statistical_validation_passed":false,"status":"candidate","synthetic":false,"wording_validation_passed":true}
