{"$schema":"../../packages/contracts/schemas/release-manifest.schema.json","aggregate_reconciled":true,"created_at":"2026-08-04T17:10:19.770592+00:00","data_version":"historical-2018-mmv-context-v2-c456aeb032917d5c","datasets":[{"byte_size":3315624,"content_hash":"889c135956320953c422177ffeb2c4c4be21b053d0d0852a0ff7b999e104125c","filters":{"data_version":"historical-2018-mmv-context-v2-c456aeb032917d5c","election_slugs":"presidencia-2018-round-1,presidencia-2018-round-2","legal_status":"context_only","source_type":"contextual_baseline"},"format":"parquet","id":"historical-2018-mmv-parquet","record_count":1128599,"schema_url":"https://eleccionesabiertas.co/schemas/historical-mmv-row.schema.json","title":{"en":"2018 mesa-level results","es":"Mesa a mesa 2018"},"url":"https://eleccionesabiertas.co/releases/historical-2018-mmv-context-v2-c456aeb032917d5c/datasets/historical-2018-mmv-parquet/889c135956320953c422177ffeb2c4c4be21b053d0d0852a0ff7b999e104125c.parquet"},{"byte_size":4930528,"content_hash":"7c29332e7f356d3d63dec914d10ca5ad97d01e560dc81ed34e63a9aed3cfb62e","filters":{"data_version":"historical-2018-mmv-context-v2-c456aeb032917d5c","election_slugs":"presidencia-2018-round-1,presidencia-2018-round-2","legal_status":"context_only","source_type":"contextual_baseline"},"format":"parquet","id":"historical-2018-rollups-parquet","record_count":1344758,"schema_url":"https://eleccionesabiertas.co/schemas/historical-rollup-row.schema.json","title":{"en":"2018 derived rollups","es":"Agregados derivados 2018"},"url":"https://eleccionesabiertas.co/releases/historical-2018-mmv-context-v2-c456aeb032917d5c/datasets/historical-2018-rollups-parquet/7c29332e7f356d3d63dec914d10ca5ad97d01e560dc81ed34e63a9aed3cfb62e.parquet"},{"byte_size":854226,"content_hash":"ca86d83bc928369073be1e21d40b01e52d05196ea2633cc2cc04e03adb9b58cf","filters":{"data_version":"historical-2018-mmv-context-v2-c456aeb032917d5c","election_slugs":"presidencia-2018-round-1,presidencia-2018-round-2","legal_status":"context_only","source_type":"contextual_baseline"},"format":"parquet","id":"historical-2018-geography-parquet","record_count":227457,"schema_url":"https://eleccionesabiertas.co/schemas/historical-geography.schema.json","title":{"en":"2018 geographic hierarchy","es":"Jerarquía geográfica 2018"},"url":"https://eleccionesabiertas.co/releases/historical-2018-mmv-context-v2-c456aeb032917d5c/datasets/historical-2018-geography-parquet/ca86d83bc928369073be1e21d40b01e52d05196ea2633cc2cc04e03adb9b58cf.parquet"}],"election_slug":"presidencia-2018-historical-context","git_commit":"uncommitted-worktree","methodology_version":"historical-context-2018/2.0.0","notes":{"en":"Historical MMV context: rounds 1/2 contain 97650/97645 observed mesas; expected national coverage is unknown. It is not verified pre-count, scrutiny, or final declaration data.","es":"Contexto histórico MMV: rondas 1/2 con 97650/97645 mesas observadas; la cobertura nacional esperada es desconocida. No es preconteo, escrutinio ni declaración final verificada."},"parser_versions":{"historical_mmv_2018":"historical-mmv-2018/2.0.0"},"release_class":"context_only","release_id":"historical-2018-mmv-context-v2-c456aeb032917d5c","schema_version":"1.0.0","sources":[{"byte_size":61121207,"content_hash":"938b4cf59f2bc40f915218e0c85f70fcc7ecb7da1be9ee5dccbfdbd71d44c371","coverage":{"ambiguous":0,"excluded":0,"expected":1,"missing":0,"parsed":1,"retrieved":1},"id":"registraduria-observatorio-2018-round-1","legal_status":"context_only","media_type":"application/zip","parser_version":"historical-mmv-2018/2.0.0","retrieved_at":"2026-08-04T17:10:19.754446+00:00","source_type":"contextual_baseline","source_url":"https://observatorio.registraduria.gov.co/anexos/MMV_NACIONAL_PRESIDENTE_2018_1v.zip","transform_version":"historical-rollup/2.0.0"},{"byte_size":16171503,"content_hash":"c3ae07d2d72f2a3bee5de5af778be3737cba098870700c52f429b3dbe6711a1b","coverage":{"ambiguous":0,"excluded":0,"expected":1,"missing":0,"parsed":1,"retrieved":1},"id":"registraduria-observatorio-2018-round-2","legal_status":"context_only","media_type":"application/zip","parser_version":"historical-mmv-2018/2.0.0","retrieved_at":"2026-08-04T17:10:19.770592+00:00","source_type":"contextual_baseline","source_url":"https://observatorio.registraduria.gov.co/anexos/MMV_NACIONAL_PRESIDENTE_2018_2v.zip","transform_version":"historical-rollup/2.0.0"}],"statistical_validation_passed":false,"status":"candidate","synthetic":false,"wording_validation_passed":true}
