{"$schema":"../../packages/contracts/schemas/release-manifest.schema.json","aggregate_reconciled":true,"created_at":"2026-08-04T01:03:02.438571+00:00","data_version":"historical-2022-mmv-context-v1","datasets":[{"byte_size":4259918,"content_hash":"d7db3c7c5e87e6eeb451ed993af7b4cc870f7734f5b72db35ff19a8d5d05fc5a","filters":{"election_slugs":"presidencia-2022-round-1,presidencia-2022-round-2","legal_status":"context_only","source_type":"contextual_baseline"},"format":"parquet","id":"historical-2022-mmv-parquet","record_count":1125896,"schema_url":"https://eleccionesabiertas.co/schemas/historical-mmv-row.schema.json","title":{"en":"2022 mesa-level results","es":"Mesa a mesa 2022"},"url":"https://eleccionesabiertas.co/releases/historical-2022-mmv-context-v1/datasets/historical-2022-mmv-parquet/d7db3c7c5e87e6eeb451ed993af7b4cc870f7734f5b72db35ff19a8d5d05fc5a.parquet"},{"byte_size":3487513,"content_hash":"a51fb7c87d055d982878a2d442312fa8b86cd6b1ada5cf78e173ba76bf2c111e","filters":{"election_slugs":"presidencia-2022-round-1,presidencia-2022-round-2","legal_status":"context_only","source_type":"contextual_baseline"},"format":"parquet","id":"historical-2022-rollups-parquet","record_count":1349277,"schema_url":"https://eleccionesabiertas.co/schemas/historical-rollup-row.schema.json","title":{"en":"2022 derived rollups","es":"Agregados derivados 2022"},"url":"https://eleccionesabiertas.co/releases/historical-2022-mmv-context-v1/datasets/historical-2022-rollups-parquet/a51fb7c87d055d982878a2d442312fa8b86cd6b1ada5cf78e173ba76bf2c111e.parquet"},{"byte_size":2715770,"content_hash":"9201f3208a25d4e982e3fc2aeb857e6de80d19850599d533ddfb7f37ad23bf17","filters":{"election_slugs":"presidencia-2022-round-1,presidencia-2022-round-2","legal_status":"context_only","source_type":"contextual_baseline"},"format":"parquet","id":"historical-2022-geography-parquet","record_count":241652,"schema_url":"https://eleccionesabiertas.co/schemas/historical-geography.schema.json","title":{"en":"2022 geographic hierarchy","es":"Jerarquía geográfica 2022"},"url":"https://eleccionesabiertas.co/releases/historical-2022-mmv-context-v1/datasets/historical-2022-geography-parquet/9201f3208a25d4e982e3fc2aeb857e6de80d19850599d533ddfb7f37ad23bf17.parquet"}],"election_slug":"presidencia-2022-historical-context","git_commit":"qa-rebuild","methodology_version":"historical-context-2022/1.0.0","notes":{"en":"Historical context from Registraduría-published MMV files. It is not verified pre-count, scrutiny, or final declaration data.","es":"Contexto histórico de archivos MMV publicados por Registraduría. No es preconteo, escrutinio ni declaración final verificada."},"parser_versions":{"historical_mmv_2022":"historical-mmv-2022/1.0.0"},"release_id":"historical-2022-mmv-context-v1","schema_version":"1.0.0","sources":[{"byte_size":5064481,"content_hash":"52443174bbe5c09d73a1b0538a1a9ae5f78afb934c7b8f98f93ea52b41872769","coverage":{"ambiguous":0,"excluded":0,"expected":103364,"missing":0,"parsed":103364,"retrieved":103364},"id":"registraduria-observatorio-2022-round-1","legal_status":"context_only","media_type":"application/zip","parser_version":"historical-mmv-2022/1.0.0","retrieved_at":"2026-08-04T00:36:28.211644+00:00","source_type":"contextual_baseline","source_url":"https://observatorio.registraduria.gov.co/anexos/MMV_NACIONAL_PRESIDENTE_2022_1v.zip","transform_version":"historical-rollup/1.0.0"},{"byte_size":2933014,"content_hash":"175ad5884ee6aceb9fb36782990c2bbabb0a4f2c84e41dbbcc74c824816c1b61","coverage":{"ambiguous":0,"excluded":0,"expected":103364,"missing":0,"parsed":103364,"retrieved":103364},"id":"registraduria-observatorio-2022-round-2","legal_status":"context_only","media_type":"application/zip","parser_version":"historical-mmv-2022/1.0.0","retrieved_at":"2026-08-04T00:36:28.591545+00:00","source_type":"contextual_baseline","source_url":"https://observatorio.registraduria.gov.co/anexos/MMV_NACIONAL_PRESIDENTE_2022_2v.zip","transform_version":"historical-rollup/1.0.0"}],"statistical_validation_passed":false,"status":"candidate","synthetic":false,"wording_validation_passed":true}
